{
  "schema": "dio.profile.v1",
  "profile_version": "1.0.0",
  "profile_id": "framework.grant_award",
  "profile_class": "framework",
  "name": "Grant Award Obligation Framework",
  "status": "source_bound",
  "binding": {
    "state": "BOUND",
    "source_bindings": [
      {
        "source_ref": "docs/DIO_OBLIGATION_FAMILY_PHASE6.md",
        "source_section": "Grant Award Obligation Framework",
        "source_version": "1.0.0",
        "content_hash": "sha256:0b5bb40260c32059e50722a05ede06a438676735738b8492e703fd4c7bf9117c",
        "source_kind": "internal_design",
        "authority_level": "internal_reference"
      }
    ]
  },
  "risk_boundary": "This internal grant award obligation framework configures vocabulary and review semantics only. It creates no legal, procurement, funder or regulatory conclusion or authority.",
  "spec": {
    "requirement_types": [
      "award_condition",
      "eligible_cost",
      "milestone",
      "reporting",
      "retention",
      "acknowledgement"
    ],
    "state_vocabulary": [
      "unverified",
      "satisfied",
      "partial",
      "missing",
      "contested",
      "expired",
      "not_yet_due",
      "needs_review"
    ],
    "deadline_semantics": [
      "award_start",
      "reporting_period",
      "milestone_date",
      "retention_period"
    ],
    "human_boundaries": [
      "human confirms award-condition interpretation",
      "human confirms cost allowability",
      "human controls funder reporting and representations"
    ],
    "forbidden_claims": [
      "allowable_cost",
      "award_compliant",
      "funder_approved",
      "legally_satisfied"
    ]
  },
  "tags": [
    "phase6",
    "WP05",
    "obligation-family",
    "grant_award"
  ]
}

